{
  "scenario_id": "scenario_03",
  "title": "Mature Extremely Severe — BIPARJOY (2023)",
  "description": "Extremely Severe Cyclonic Storm BIPARJOY in the Arabian Sea at peak intensity. Long-lived cyclone that threatened the Gujarat coast. Data curated from public records, marked as demo.",
  "cyclone": {
    "id": "DEMO_BIPARJOY_2023",
    "name": "BIPARJOY",
    "basin": "NI",
    "season_year": 2023,
    "status": "demo"
  },
  "latest_observation": {
    "observed_at": "2023-06-12T12:00:00+00:00",
    "latitude": 17.2,
    "longitude": 64.8,
    "wind_speed_kmh": 185.0,
    "pressure_hpa": 944.0,
    "movement_direction_deg": 330.0,
    "movement_speed_kmh": 8.0,
    "intensity_category": "Extremely Severe Cyclonic Storm"
  },
  "historical_observations": [
    {
      "observed_at": "2023-06-08T00:00:00+00:00",
      "latitude": 14.0,
      "longitude": 67.0,
      "wind_speed_kmh": 65.0,
      "pressure_hpa": 996.0,
      "movement_direction_deg": 320.0,
      "movement_speed_kmh": 6.0,
      "intensity_category": "Cyclonic Storm"
    },
    {
      "observed_at": "2023-06-10T00:00:00+00:00",
      "latitude": 15.5,
      "longitude": 66.0,
      "wind_speed_kmh": 120.0,
      "pressure_hpa": 972.0,
      "movement_direction_deg": 325.0,
      "movement_speed_kmh": 7.0,
      "intensity_category": "Very Severe Cyclonic Storm"
    },
    {
      "observed_at": "2023-06-11T12:00:00+00:00",
      "latitude": 16.5,
      "longitude": 65.2,
      "wind_speed_kmh": 170.0,
      "pressure_hpa": 950.0,
      "movement_direction_deg": 328.0,
      "movement_speed_kmh": 7.5,
      "intensity_category": "Extremely Severe Cyclonic Storm"
    }
  ],
  "weather": {
    "latitude": 17.2,
    "longitude": 64.8,
    "wind_speed_kmh": 185.0,
    "pressure_hpa": 944.0,
    "temperature_c": 28.8,
    "sea_surface_temp_c": null,
    "observed_at": "2023-06-12T12:00:00+00:00",
    "source": "demo"
  },
  "satellite": {
    "image_id": "demo_vis_cyclone_02",
    "cyclone_id": "DEMO_BIPARJOY_2023",
    "captured_at": "2023-06-12T09:00:00+00:00",
    "image_type": "visible",
    "source": "demo",
    "storage_path": "data/demo/images/cyclone/demo_vis_cyclone_02.png",
    "is_cyclone": true
  },
  "source": {
    "mode": "demo",
    "provider": "demo",
    "processing_script": "scripts/create_demo_scenarios.py",
    "processing_version": "0.1.0"
  },
  "created_at": "2026-09-09T04:47:40.210154+00:00"
}